{
  "version": "1.0.0",
  "jurisdiction": "Karnataka, India",
  "last_updated": "2024-10-20",
  "records": [
    {
      "record_id": "KA-MW-SEC-2024-Z1-SEMI",
      "schedule_name": "Security Agency / Private Security Guards",
      "occupation_titles": [
        "security_guard",
        "security guard",
        "security guard without arms",
        "watchman",
        "head_guard",
        "head guard",
        "chowkidar",
        "ಸೆಕ್ಯುರಿಟಿ ಗಾರ್ಡ್",
        "ಕಾವಲುಗಾರ"
      ],
      "skill_classification": "semi_skilled",
      "applicable_zone": "Zone 1",
      "zone_description": "Bruhat Bengaluru Mahanagara Palike (BBMP) and surrounding city agglomeration areas",
      "effective_from": "2024-04-01",
      "effective_to": "2025-03-31",
      "wage_period": "monthly",
      "basic_wage_monthly": 15742.26,
      "vda_monthly": 2223.60,
      "total_minimum_wage_monthly": 17965.86,
      "total_minimum_wage_daily": 690.99,
      "statutory_hours_per_day": 8,
      "working_days_per_month_basis": 26,
      "legal_authority": "Government of Karnataka, Department of Labour",
      "notification_number": "Notification No. KAE 34 LWA 2022 (VDA Circular 2024-2025)",
      "source_url": "https://labour.karnataka.gov.in/",
      "verification_status": "verified",
      "verified_by": "Namma Sambala Legal & Wage Research Working Group",
      "verification_date": "2024-10-18",
      "verification_notes": "Minimum wages for unarmed security guards under Karnataka Private Security Agency schedule for Zone 1 (BBMP). Monthly minimum is based on 26 paid working days. Any working hours exceeding 8 hours/day must be compensated as overtime at double normal rate. Deductions for uniforms or equipment are strictly prohibited if they reduce net pay below the statutory minimum."
    },
    {
      "record_id": "KA-MW-SEC-2024-Z1-SKILLED",
      "schedule_name": "Security Agency / Private Security Guards",
      "occupation_titles": [
        "security_supervisor",
        "security supervisor",
        "security inspector",
        "security inspector / supervisor",
        "ಸೆಕ್ಯುರಿಟಿ ಸೂಪರ್‌ವೈಸರ್"
      ],
      "skill_classification": "skilled",
      "applicable_zone": "Zone 1",
      "zone_description": "Bruhat Bengaluru Mahanagara Palike (BBMP) and surrounding city agglomeration areas",
      "effective_from": "2024-04-01",
      "effective_to": "2025-03-31",
      "wage_period": "monthly",
      "basic_wage_monthly": 16058.30,
      "vda_monthly": 2223.60,
      "total_minimum_wage_monthly": 18281.90,
      "total_minimum_wage_daily": 703.15,
      "statutory_hours_per_day": 8,
      "working_days_per_month_basis": 26,
      "legal_authority": "Government of Karnataka, Department of Labour",
      "notification_number": "Notification No. KAE 34 LWA 2022 (VDA Circular 2024-2025)",
      "source_url": "https://labour.karnataka.gov.in/",
      "verification_status": "verified",
      "verified_by": "Namma Sambala Legal & Wage Research Working Group",
      "verification_date": "2024-10-18",
      "verification_notes": "Minimum wages for security supervisors/inspectors under Karnataka Private Security Agency schedule for Zone 1 (BBMP). Monthly minimum based on 26 paid working days."
    },
    {
      "record_id": "KA-MW-SHOPS-2024-Z1-UNSKILLED",
      "schedule_name": "Shops and Commercial Establishments",
      "occupation_titles": [
        "helper",
        "shop_helper",
        "peon",
        "office_boy",
        "office boy",
        "attender",
        "cleaner",
        "shop cleaner",
        "sweeper",
        "ಹಂಪರ್",
        "ಪ್ಯೂನ್"
      ],
      "skill_classification": "unskilled",
      "applicable_zone": "Zone 1",
      "zone_description": "Bruhat Bengaluru Mahanagara Palike (BBMP) limits",
      "effective_from": "2024-04-01",
      "effective_to": "2025-03-31",
      "wage_period": "monthly",
      "basic_wage_monthly": 11587.83,
      "vda_monthly": 3518.40,
      "total_minimum_wage_monthly": 15106.23,
      "total_minimum_wage_daily": 581.01,
      "statutory_hours_per_day": 8,
      "working_days_per_month_basis": 26,
      "legal_authority": "Government of Karnataka, Department of Labour",
      "notification_number": "Notification No. KAE 20 LWA 2015 (VDA Revision 2024-2025)",
      "source_url": "https://labour.karnataka.gov.in/",
      "verification_status": "verified",
      "verified_by": "Namma Sambala Legal & Wage Research Working Group",
      "verification_date": "2024-10-18",
      "verification_notes": "Covers un-skilled general helpers, peons, messengers, cleaners in retail shops, commercial offices, and establishments in BBMP limits."
    },
    {
      "record_id": "KA-MW-SHOPS-2024-Z1-SEMI",
      "schedule_name": "Shops and Commercial Establishments",
      "occupation_titles": [
        "assistant_salesman",
        "assistant salesman",
        "assistant sales girl",
        "bill_clerk",
        "bill clerk",
        "bill collector",
        "packer",
        "godown_keeper",
        "shop_assistant",
        "shop assistant",
        "ಅಸಿಸ್ಟೆಂಟ್ ಸೇಲ್ಸ್‌ಮ್ಯಾನ್",
        "ಬಿಲ್ ಕ್ಲರ್ಕ್"
      ],
      "skill_classification": "semi_skilled",
      "applicable_zone": "Zone 1",
      "zone_description": "Bruhat Bengaluru Mahanagara Palike (BBMP) limits",
      "effective_from": "2024-04-01",
      "effective_to": "2025-03-31",
      "wage_period": "monthly",
      "basic_wage_monthly": 12746.61,
      "vda_monthly": 3518.40,
      "total_minimum_wage_monthly": 16265.01,
      "total_minimum_wage_daily": 625.58,
      "statutory_hours_per_day": 8,
      "working_days_per_month_basis": 26,
      "legal_authority": "Government of Karnataka, Department of Labour",
      "notification_number": "Notification No. KAE 20 LWA 2015 (VDA Revision 2024-2025)",
      "source_url": "https://labour.karnataka.gov.in/",
      "verification_status": "verified",
      "verified_by": "Namma Sambala Legal & Wage Research Working Group",
      "verification_date": "2024-10-18",
      "verification_notes": "Covers semi-skilled roles including assistant salesmen, clerks, packers, and godown keepers in retail and commercial shops."
    },
    {
      "record_id": "KA-MW-SHOPS-2024-Z1-SKILLED",
      "schedule_name": "Shops and Commercial Establishments",
      "occupation_titles": [
        "salesman",
        "sales person",
        "salesperson",
        "sales_girl",
        "sales executive",
        "retail_sales",
        "retail sales",
        "cashier",
        "store_incharge",
        "ಮಾರಾಟಗಾರ",
        "ಸೇಲ್ಸ್‌ಮ್ಯಾನ್"
      ],
      "skill_classification": "skilled",
      "applicable_zone": "Zone 1",
      "zone_description": "Bruhat Bengaluru Mahanagara Palike (BBMP) limits",
      "effective_from": "2024-04-01",
      "effective_to": "2025-03-31",
      "wage_period": "monthly",
      "basic_wage_monthly": 14021.27,
      "vda_monthly": 3518.40,
      "total_minimum_wage_monthly": 17539.67,
      "total_minimum_wage_daily": 674.60,
      "statutory_hours_per_day": 8,
      "working_days_per_month_basis": 26,
      "legal_authority": "Government of Karnataka, Department of Labour",
      "notification_number": "Notification No. KAE 20 LWA 2015 (VDA Revision 2024-2025)",
      "source_url": "https://labour.karnataka.gov.in/",
      "verification_status": "verified",
      "verified_by": "Namma Sambala Legal & Wage Research Working Group",
      "verification_date": "2024-10-18",
      "verification_notes": "Covers skilled retail sales workers, cashiers, and customer service staff in commercial establishments in BBMP Zone 1."
    },
    {
      "record_id": "KA-MW-CONST-2024-Z1-UNSKILLED",
      "schedule_name": "Building and Other Construction Works",
      "occupation_titles": [
        "construction_labourer",
        "construction labourer",
        "construction_worker",
        "construction worker",
        "mazdoor",
        "coolie",
        "general helper construction",
        "ಕಟ್ಟಡ ಕಾರ್ಮಿಕ",
        "ಮಜದೂರ್"
      ],
      "skill_classification": "unskilled",
      "applicable_zone": "Zone 1",
      "zone_description": "Bruhat Bengaluru Mahanagara Palike (BBMP) and urban agglomeration",
      "effective_from": "2024-04-01",
      "effective_to": "2025-03-31",
      "wage_period": "monthly",
      "basic_wage_monthly": 15614.76,
      "vda_monthly": 1795.20,
      "total_minimum_wage_monthly": 17409.96,
      "total_minimum_wage_daily": 669.61,
      "statutory_hours_per_day": 8,
      "working_days_per_month_basis": 26,
      "legal_authority": "Government of Karnataka, Department of Labour",
      "notification_number": "Notification No. KAE 83 LWA 2022 (VDA Circular 2024-2025)",
      "source_url": "https://labour.karnataka.gov.in/",
      "verification_status": "verified",
      "verified_by": "Namma Sambala Legal & Wage Research Working Group",
      "verification_date": "2024-10-18",
      "verification_notes": "Unskilled construction labour / mazdoor in Zone 1. Equal wages for men and women mandated under Section 12 of the Equal Remuneration Act & Minimum Wages Act."
    },
    {
      "record_id": "KA-MW-CONST-2024-Z1-SKILLED",
      "schedule_name": "Building and Other Construction Works",
      "occupation_titles": [
        "mason",
        "carpenter",
        "plumber",
        "electrician",
        "fitter",
        "welder",
        "painter",
        "brick layer",
        "ಮೇಸ್ತ್ರಿ",
        "ಬಡಗಿ",
        "ಪ್ಲಂಬರ್",
        "ಎಲೆಕ್ಟ್ರಿಷಿಯನ್"
      ],
      "skill_classification": "skilled",
      "applicable_zone": "Zone 1",
      "zone_description": "Bruhat Bengaluru Mahanagara Palike (BBMP) and urban agglomeration",
      "effective_from": "2024-04-01",
      "effective_to": "2025-03-31",
      "wage_period": "monthly",
      "basic_wage_monthly": 16479.91,
      "vda_monthly": 1795.20,
      "total_minimum_wage_monthly": 18275.11,
      "total_minimum_wage_daily": 702.89,
      "statutory_hours_per_day": 8,
      "working_days_per_month_basis": 26,